{
  "success": false,
  "obstruction": 1920.2691259447674,
  "iterations": 1,
  "message": "Partial: 60% placed, obstruction 1920.27",
  "violations": [
    "NonOverlapConstraint: {'unit_3br_17', 'elevator_passenger_1_f2'} = 87.12",
    "NonOverlapConstraint: {'unit_3br_29', 'elevator_passenger_1_f2'} = 13.12",
    "NonOverlapConstraint: {'unit_3br_17', 'elevator_passenger_2_f2'} = 87.12",
    "NonOverlapConstraint: {'elevator_passenger_2_f2', 'unit_3br_29'} = 13.12",
    "NonOverlapConstraint: {'unit_3br_17', 'stair_1_f2'} = 117.17",
    "NonOverlapConstraint: {'unit_3br_29', 'stair_1_f2'} = 27.49",
    "NonOverlapConstraint: {'stair_2_f2', 'unit_3br_17'} = 108.28",
    "NonOverlapConstraint: {'stair_2_f2', 'unit_3br_29'} = 27.49",
    "NonOverlapConstraint: {'unit_3br_2', 'elevator_passenger_1_f3'} = 13.12",
    "NonOverlapConstraint: {'unit_3br_18', 'elevator_passenger_1_f3'} = 87.12"
  ],
  "metrics": {
    "placement_rate": "60.1%",
    "avg_membership": "0.99",
    "total_spaces": 268,
    "placed_spaces": 161
  },
  "building": {
    "floors": [
      {
        "floor_index": -1,
        "floor_type": "PARKING_UNDERGROUND",
        "boundary": [
          [
            -69.48021301061188,
            -69.48021301061188
          ],
          [
            69.48021301061188,
            -69.48021301061188
          ],
          [
            69.48021301061188,
            69.48021301061188
          ],
          [
            -69.48021301061188,
            69.48021301061188
          ]
        ],
        "area_sf": 19310.0,
        "spaces": [
          {
            "id": "elevator_passenger_1_f-1",
            "type": "CIRCULATION",
            "name": "Passenger Elevator 1",
            "floor_index": -1,
            "geometry": {
              "x": -5.0,
              "y": 0.0,
              "width": 8.0,
              "height": 17.0,
              "rotation": 0
            },
            "target_area_sf": 136,
            "actual_area_sf": 136.0,
            "membership": 1.0,
            "area_deviation": "+0.0%",
            "is_vertical": true
          },
          {
            "id": "elevator_passenger_2_f-1",
            "type": "CIRCULATION",
            "name": "Passenger Elevator 2",
            "floor_index": -1,
            "geometry": {
              "x": 4.0,
              "y": 0.0,
              "width": 8.0,
              "height": 17.0,
              "rotation": 0
            },
            "target_area_sf": 136,
            "actual_area_sf": 136.0,
            "membership": 1.0,
            "area_deviation": "+0.0%",
            "is_vertical": true
          },
          {
            "id": "stair_1_f-1",
            "type": "CIRCULATION",
            "name": "Stair 1",
            "floor_index": -1,
            "geometry": {
              "x": -14.84767985741633,
              "y": 0.0,
              "width": 9.695359714832659,
              "height": 19.390719429665314,
              "rotation": 0
            },
            "target_area_sf": 188,
            "actual_area_sf": 188.0,
            "membership": 1.0,
            "area_deviation": "+0.0%",
            "is_vertical": true
          },
          {
            "id": "stair_2_f-1",
            "type": "CIRCULATION",
            "name": "Stair 2",
            "floor_index": -1,
            "geometry": {
              "x": 13.84767985741633,
              "y": 0.0,
              "width": 9.695359714832659,
              "height": 19.390719429665314,
              "rotation": 0
            },
            "target_area_sf": 188,
            "actual_area_sf": 188.0,
            "membership": 1.0,
            "area_deviation": "+0.0%",
            "is_vertical": true
          },
          {
            "id": "support_6",
            "type": "SUPPORT",
            "name": "Storage - General",
            "floor_index": -1,
            "geometry": {
              "x": 60.01362074907784,
              "y": 17.46659226153404,
              "width": 14.933184523068078,
              "height": 14.933184523068078,
              "rotation": 0
            },
            "target_area_sf": 223,
            "actual_area_sf": 223.0,
            "membership": 1.0,
            "area_deviation": "+0.0%",
            "is_vertical": false
          },
          {
            "id": "support_7_f-1_1",
            "type": "SUPPORT",
            "name": "Storage - Janitor",
            "floor_index": -1,
            "geometry": {
              "x": 61.15565769027512,
              "y": 31.32455532033676,
              "width": 12.649110640673518,
              "height": 12.649110640673518,
              "rotation": 0
            },
            "target_area_sf": 160,
            "actual_area_sf": 160.00000000000003,
            "membership": 1.0,
            "area_deviation": "+0.0%",
            "is_vertical": false
          },
          {
            "id": "support_7_f-1_2",
            "type": "SUPPORT",
            "name": "Storage - Janitor",
            "floor_index": -1,
            "geometry": {
              "x": 61.15565769027512,
              "y": 44.324555320336756,
              "width": 12.649110640673518,
              "height": 12.649110640673518,
              "rotation": 0
            },
            "target_area_sf": 160,
            "actual_area_sf": 160.00000000000003,
            "membership": 1.0,
            "area_deviation": "+0.0%",
            "is_vertical": false
          },
          {
            "id": "support_7_f-1_3",
            "type": "SUPPORT",
            "name": "Storage - Janitor",
            "floor_index": -1,
            "geometry": {
              "x": 61.15565769027512,
              "y": 57.324555320336756,
              "width": 12.649110640673518,
              "height": 12.649110640673518,
              "rotation": 0
            },
            "target_area_sf": 160,
            "actual_area_sf": 160.00000000000003,
            "membership": 1.0,
            "area_deviation": "+0.0%",
            "is_vertical": false
          },
          {
            "id": "support_7_f-1_4",
            "type": "SUPPORT",
            "name": "Storage - Janitor",
            "floor_index": -1,
            "geometry": {
              "x": -60.675444679663244,
              "y": 61.15565769027512,
              "width": 12.649110640673518,
              "height": 12.649110640673518,
              "rotation": 0
            },
            "target_area_sf": 160,
            "actual_area_sf": 160.00000000000003,
            "membership": 1.0,
            "area_deviation": "+0.0%",
            "is_vertical": false
          },
          {
            "id": "mep_low_voltage_2_f-1",
            "type": "LOW_VOLTAGE",
            "name": "IDF Closets",
            "floor_index": -1,
            "geometry": {
              "x": -60.07179676972449,
              "y": -60.55200978033637,
              "width": 13.856406460551018,
              "height": 13.856406460551018,
              "rotation": 0
            },
            "target_area_sf": 192,
            "actual_area_sf": 191.99999999999997,
            "membership": 1.0,
            "area_deviation": "-0.0%",
            "is_vertical": false
          },
          {
            "id": "mep_electrical_1",
            "type": "ELECTRICAL",
            "name": "Main Electrical Room",
            "floor_index": -1,
            "geometry": {
              "x": -44.05572809000084,
              "y": -58.53594110061272,
              "width": 17.88854381999832,
              "height": 17.88854381999832,
              "rotation": 0
            },
            "target_area_sf": 320,
            "actual_area_sf": 320.00000000000006,
            "membership": 1.0,
            "area_deviation": "+0.0%",
            "is_vertical": false
          },
          {
            "id": "mep_electrical_3",
            "type": "ELECTRICAL",
            "name": "Emergency Inverter Room",
            "floor_index": -1,
            "geometry": {
              "x": -27.400657923214666,
              "y": -59.88087093382654,
              "width": 15.198684153570664,
              "height": 15.198684153570664,
              "rotation": 0
            },
            "target_area_sf": 231,
            "actual_area_sf": 231.0,
            "membership": 1.0,
            "area_deviation": "+0.0%",
            "is_vertical": false
          },
          {
            "id": "mep_electrical_4",
            "type": "ELECTRICAL",
            "name": "Solar Battery/UPS Room",
            "floor_index": -1,
            "geometry": {
              "x": -9.632503002402403,
              "y": -58.11271601301428,
              "width": 18.734993995195193,
              "height": 18.734993995195193,
              "rotation": 0
            },
            "target_area_sf": 351,
            "actual_area_sf": 350.99999999999994,
            "membership": 1.0,
            "area_deviation": "-0.0%",
            "is_vertical": false
          },
          {
            "id": "mep_mechanical_3_f-1",
            "type": "MECHANICAL",
            "name": "Mech Shaft - Ventilation",
            "floor_index": -1,
            "geometry": {
              "x": 5.545268253204709,
              "y": -61.934944757407166,
              "width": 11.090536506409418,
              "height": 11.090536506409418,
              "rotation": 0
            },
            "target_area_sf": 123,
            "actual_area_sf": 123.00000000000001,
            "membership": 1.0,
            "area_deviation": "+0.0%",
            "is_vertical": false
          },
          {
            "id": "mep_plumbing_1",
            "type": "PLUMBING",
            "name": "Domestic Water Booster Room",
            "floor_index": -1,
            "geometry": {
              "x": 18.36396103067893,
              "y": -61.11625197993295,
              "width": 12.727922061357855,
              "height": 12.727922061357855,
              "rotation": 0